{
  "video_id": "00e0991fbc61ad24102b_run_4_seed_1246964153.ceiling_00.rgb",
  "filename": "00e0991fbc61ad24102b_run_4_seed_1246964153.ceiling_00.rgb.mp4",
  "category": "near_miss",
  "duration_sec": 10.0,
  "labeled_by": "human",
  "summary": "Forklift çalışanın çok yakınından geçti. Neredeyse temas edeceklerdi.",
  "events": [
    {
      "time": "00:03",
      "time_end": "00:06",
      "event": "Forklift çalışanın çok yakınından geçti. ",
      "event_type": "near_miss",
      "severity": "orta"
    }
  ],
  "risk": "Orta",
  "actions": [
    "Rutin izlemeye devam et"
  ],
  "notes": "",
  "status": "gold"
}