{
  "video_id": "R4pN50yYI5k_trim_2",
  "filename": "R4pN50yYI5k_trim_2.mp4",
  "category": "accident",
  "duration_sec": 6.01,
  "labeled_by": "human",
  "summary": "Forklift raf sistemine çarpıyor ve raflar devriliyor.",
  "events": [
    {
      "time": "00:03",
      "time_end": "00:06",
      "event": "Forklift raf sistemine çarpıyor ve raflar devriliyor.",
      "event_type": "normal",
      "severity": "yuksek"
    }
  ],
  "risk": "Yüksek",
  "actions": [
    "Sağlık ekibi çağır."
  ],
  "notes": "",
  "status": "gold"
}