{
  "video_id": "0137e00c677a4118e887_run_2_seed_1276653305.ceiling_00.rgb",
  "filename": "0137e00c677a4118e887_run_2_seed_1276653305.ceiling_00.rgb.mp4",
  "category": "near_miss",
  "duration_sec": 10.0,
  "labeled_by": "human",
  "summary": "Forklift çalışanın çok yakınından geçti. Neredeyse temas edeceklerdi.",
  "events": [
    {
      "time": "00:03",
      "time_end": "00:04",
      "event": "Forklift çalışanın çok yakınından geçti.",
      "event_type": "near_miss",
      "severity": "orta"
    },
    {
      "time": "00:07",
      "time_end": "00:08",
      "event": "Forklift çalışanın çok yakınından geçti.",
      "event_type": "near_miss",
      "severity": "orta"
    }
  ],
  "risk": "Düşük",
  "actions": [
    "Rutin izlemeye devam et"
  ],
  "notes": "",
  "status": "gold"
}