{
  "video_id": "019b03676f77ba21f644_run_5_seed_946900070.ceiling_00.rgb",
  "filename": "019b03676f77ba21f644_run_5_seed_946900070.ceiling_00.rgb.mp4",
  "category": "near_miss",
  "duration_sec": 10.0,
  "labeled_by": "human",
  "summary": "Forklift çalışanın çok yakınından geçti. Neredeyse temas edeceklerdi.",
  "events": [
    {
      "time": "00:05",
      "time_end": "00:07",
      "event": "Forklift çalışanın çok yakınından geçti. ",
      "event_type": "near_miss",
      "severity": "orta"
    }
  ],
  "risk": "Orta",
  "actions": [
    "rutin izlemeye devam et",
    "alanı güvene al"
  ],
  "notes": "",
  "status": "gold"
}