{
  "video_id": "Double_accident_at_work_in_China_-_720p",
  "filename": "Double accident at work in China - 厲害了我的國 (720p).mp4",
  "category": "accident",
  "duration_sec": 57.05,
  "status": "auto",
  "labeled_by": "qwen:qwen2.5vl:7b",
  "summary": "İşçi, robot tarafından taşılan malzemenin altında duruyor.",
  "events": [
    {
      "time": "00:19",
      "time_end": "00:38",
      "event": "İşçi, robot tarafından taşılan malzemenin altında duruyor",
      "event_type": "near_miss",
      "severity": "orta"
    }
  ],
  "risk": "Orta",
  "actions": [
    "Robot hareketini durdurun",
    "İşçiyi malzemenin altından çıkartın"
  ],
  "notes": "Otomatik taslak. Gold değil; Streamlit'te kontrol edin."
}