{
  "video_id": "accident_f6e64d87ca",
  "filename": "The Public Record - https：⧸⧸t.co⧸19h6ftihJO  🚨 BREAKING NEWS ｜ SOCIAL MEDIA • Workplace S... [2042443212972048390].mp4",
  "category": "accident",
  "duration_sec": 45.0,
  "labeled_by": "human",
  "summary": "Çalışanın üzerine ağır yük devriliyor.",
  "events": [
    {
      "time": "00:06",
      "time_end": "00:10",
      "event": "Yük işçinin üzerine düşüyor.",
      "event_type": "kaza",
      "severity": "yuksek"
    },
    {
      "time": "00:12",
      "time_end": "00:45",
      "event": "işçiler yükleri işçinin üzerinden alıyor",
      "event_type": "mudahale",
      "severity": "yuksek"
    }
  ],
  "risk": "Yüksek",
  "actions": [
    "Sağlık ekibi çağır."
  ],
  "notes": "",
  "status": "gold"
}